<?xml version="1.0" encoding="UTF-8"?>
<!DOCTYPE problem SYSTEM "problem-2.0.dtd">
<problem domain="SmartPhone" name="OrganizeMeeting_VerySmall" type="pure-hierarchical">
    <constantDeclaration name="agenda" sort="Agenda"/>
    <constantDeclaration name="contact1" sort="Contact"/>
    <constantDeclaration name="headOfDepartment" sort="Person"/>
    <constantDeclaration name="headOfDepartmentEMailAddress"
                         sort="EMailAddress"/>
    <constantDeclaration name="dateForMeeting" sort="Date"/>
    <constantDeclaration name="email1" sort="EMail"/>
    <constantDeclaration name="account1" sort="EMailAccount"/>
    <constantDeclaration name="room101" sort="Location"/>
    <constantDeclaration name="headOfDepartmentPicture" sort="Picture"/>
    <initialState>
        <fact relation="associated_Contact">
            <constant name="contact1"/>
            <constant name="headOfDepartment"/>
        </fact>
        <fact relation="associated_Picture">
            <constant name="contact1"/>
            <constant name="headOfDepartmentPicture"/>
        </fact>
        <fact relation="created">
            <constant name="contact1"/>
        </fact>
        <fact relation="haveInformation_Contactable">
            <constant name="headOfDepartment"/>
            <constant name="headOfDepartmentEMailAddress"/>
        </fact>
        <fact relation="haveInformation_Regular">
            <constant name="agenda"/>
        </fact>
        <fact relation="haveInformation_Regular">
            <constant name="dateForMeeting"/>
        </fact>
        <fact relation="haveInformation_Regular">
            <constant name="headOfDepartmentPicture"/>
        </fact>
        <fact relation="haveInformation_Regular">
            <constant name="room101"/>
        </fact>
        <fact relation="inMode_Home"/>
        <fact relation="inUse">
            <constant name="contact1"/>
        </fact>
        <fact relation="isFavourite">
            <constant name="contact1"/>
        </fact>
        <fact relation="selected">
            <constant name="account1"/>
        </fact>
    </initialState>
    <goals>
        <fact relation="hasInformation_Regular">
            <constant name="headOfDepartment"/>
            <constant name="dateForMeeting"/>
        </fact>
        <fact relation="hasInformation_Regular">
            <constant name="headOfDepartment"/>
            <constant name="room101"/>
        </fact>
        <fact relation="hasInformation_Regular">
            <constant name="headOfDepartment"/>
            <constant name="agenda"/>
        </fact>
    </goals>
    <initialTaskNetwork>
        <taskNode name="attachMultipleInformationToEmail1" taskSchema="attachMultipleInformation">
            <variableDeclaration
                    name="attachMultipleInformationToEmail1_message" sort="Message"/>
        </taskNode>
        <taskNode name="sendEmail1ToHeadOfDepartment" taskSchema="send_EMail">
            <variableDeclaration name="sendEmail1ToHeadOfDepartment_receipient" sort="Contactable"/>
            <variableDeclaration name="sendEmail1ToHeadOfDepartment_email" sort="EMail"/>
        </taskNode>
        <taskNode name="extractsMultipleInformation_headOfDepartment" taskSchema="extractsMultipleInformation">
            <variableDeclaration
                    name="extractsMultipleInformation_headOfDepartment_contactable" sort="Contactable"/>
            <variableDeclaration
                    name="extractsMultipleInformation_headOfDepartment_message" sort="Message"/>
        </taskNode>
        <orderingConstraint
                predecessor="attachMultipleInformationToEmail1" successor="sendEmail1ToHeadOfDepartment"/>
        <orderingConstraint predecessor="sendEmail1ToHeadOfDepartment" successor="extractsMultipleInformation_headOfDepartment"/>
        <valueRestriction type="eq" variable="attachMultipleInformationToEmail1_message">
            <constant name="email1"/>
        </valueRestriction>
        <valueRestriction type="eq" variable="sendEmail1ToHeadOfDepartment_email">
            <constant name="email1"/>
        </valueRestriction>
        <valueRestriction type="eq" variable="sendEmail1ToHeadOfDepartment_receipient">
            <constant name="headOfDepartment"/>
        </valueRestriction>
        <valueRestriction type="eq" variable="extractsMultipleInformation_headOfDepartment_contactable">
            <constant name="headOfDepartment"/>
        </valueRestriction>
        <valueRestriction type="eq" variable="extractsMultipleInformation_headOfDepartment_message">
            <constant name="email1"/>
        </valueRestriction>
        <causalLink
                consumer="extractsMultipleInformation_headOfDepartment" producer="sendEmail1ToHeadOfDepartment">
            <atomic relation="hasReceived">
                <constant name="headOfDepartment"/>
                <constant name="email1"/>
            </atomic>
        </causalLink>
    </initialTaskNetwork>
</problem>
