<?xml version="1.0" encoding="UTF-8"?>
<!DOCTYPE problem SYSTEM "problem-2.0.dtd">
<problem domain="SmartPhone" name="OrganizeMeeting_VeryVerySmall" type="pure-hierarchical">
   <constantDeclaration name="agenda" sort="Agenda"/>
   <constantDeclaration name="contact1" sort="Contact"/>
   <constantDeclaration name="headOfDepartment" sort="Person"/>
   <constantDeclaration name="headOfDepartmentEMailAddress"
      sort="EMailAddress"/>
   <constantDeclaration name="dateForMeeting" sort="Date"/>
   <constantDeclaration name="email1" sort="EMail"/>
   <constantDeclaration name="account1" sort="EMailAccount"/>
   <constantDeclaration name="room101" sort="Location"/>
   <constantDeclaration name="headOfDepartmentPicture" sort="Picture"/>
   <initialState>
      <fact relation="associated_Contact">
         <constant name="contact1"/>
         <constant name="headOfDepartment"/>
      </fact>
      <fact relation="associated_Picture">
         <constant name="contact1"/>
         <constant name="headOfDepartmentPicture"/>
      </fact>
      <fact relation="created">
         <constant name="contact1"/>
      </fact>
      <fact relation="haveInformation_Contactable">
         <constant name="headOfDepartment"/>
         <constant name="headOfDepartmentEMailAddress"/>
      </fact>
      <fact relation="haveInformation_Regular">
         <constant name="agenda"/>
      </fact>
      <fact relation="haveInformation_Regular">
         <constant name="dateForMeeting"/>
      </fact>
      <fact relation="haveInformation_Regular">
         <constant name="headOfDepartmentPicture"/>
      </fact>
      <fact relation="haveInformation_Regular">
         <constant name="room101"/>
      </fact>
      <fact relation="inMode_Home"/>
      <fact relation="inUse">
         <constant name="contact1"/>
      </fact>
      <fact relation="isFavourite">
         <constant name="contact1"/>
      </fact>
      <fact relation="selected">
         <constant name="account1"/>
      </fact>
   </initialState>
   <goals>
      <fact relation="hasInformation_Regular">
         <constant name="headOfDepartment"/>
         <constant name="dateForMeeting"/>
      </fact>
   </goals>
   <initialTaskNetwork>
      <taskNode name="attachInformationToEmail1" taskSchema="attachInformationToEMail">
         <variableDeclaration name="attachInformationToEmail1_email" sort="EMail"/>
         <variableDeclaration name="attachInformationToEmail1_information" sort="TransferableByEmail"/>
      </taskNode>
      <taskNode name="sendEmail1ToHeadOfDepartment" taskSchema="send_EMail">
         <variableDeclaration name="sendEmail1ToHeadOfDepartment_receipient" sort="Contactable"/>
         <variableDeclaration name="sendEmail1ToHeadOfDepartment_email" sort="EMail"/>
      </taskNode>
      <taskNode name="extractsInformation_headOfDepartment" taskSchema="extractsInformation">
         <variableDeclaration
            name="extractsInformation_headOfDepartment_receiver" sort="Contactable"/>
         <variableDeclaration
            name="extractsInformation_headOfDepartment_email" sort="Message"/>
         <variableDeclaration
            name="extractsInformation_headOfDepartment_information" sort="Information"/>
      </taskNode>
      <orderingConstraint predecessor="sendEmail1ToHeadOfDepartment" successor="extractsInformation_headOfDepartment"/>
      <orderingConstraint predecessor="attachInformationToEmail1" successor="extractsInformation_headOfDepartment"/>
      <valueRestriction type="eq" variable="attachInformationToEmail1_email">
         <constant name="email1"/>
      </valueRestriction>
      <valueRestriction type="eq" variable="sendEmail1ToHeadOfDepartment_email">
         <constant name="email1"/>
      </valueRestriction>
      <valueRestriction type="eq" variable="sendEmail1ToHeadOfDepartment_receipient">
         <constant name="headOfDepartment"/>
      </valueRestriction>
      <valueRestriction type="eq" variable="extractsInformation_headOfDepartment_email">
         <constant name="email1"/>
      </valueRestriction>
      <valueRestriction type="eq" variable="extractsInformation_headOfDepartment_information">
         <constant name="dateForMeeting"/>
      </valueRestriction>
      <valueRestriction type="eq" variable="extractsInformation_headOfDepartment_receiver">
         <constant name="headOfDepartment"/>
      </valueRestriction>
	  <valueRestriction type="eq" variable="attachInformationToEmail1_information">
         <constant name="dateForMeeting"/>
      </valueRestriction>
      <causalLink consumer="extractsInformation_headOfDepartment" producer="attachInformationToEmail1">
         <atomic relation="attached">
            <constant name="email1"/>
            <constant name="dateForMeeting"/>
         </atomic>
      </causalLink>
      <causalLink consumer="extractsInformation_headOfDepartment" producer="sendEmail1ToHeadOfDepartment">
         <atomic relation="hasReceived">
            <constant name="headOfDepartment"/>
            <constant name="email1"/>
         </atomic>
      </causalLink>
   </initialTaskNetwork>
</problem>
